{
  "title": "Editorial: reconsidering metformin in the era of new diabetes drugs",
  "year": "2022",
  "source_type": "editorial",
  "id": "edi-004",
  "text_summary": "Opinion on whether metformin should remain first-line therapy for diabetes.",
  "text": "This editorial discusses whether metformin should remain the default first-line agent given the emergence of GLP-1 receptor agonists and SGLT2 inhibitors. The author argues that comparative effectiveness evidence remains limited and individualized therapy should be prioritized.",
  "image_summary": [],
  "image_base_64": [],
  "evidence_level": "editorial",
  "last_retrieved_at": "2026-08-12"
}
