{
    "id": "paper_008",
    "title": "An Image is Worth 16x16 Words: Transformers for Image Recognition at Scale",
    "year": "2021",
    "source_type": "conference",
    "text": "We introduce Vision Transformer (ViT), which applies a pure transformer architecture directly to sequences of image patches for image classification. When pre-trained on large amounts of data and transferred to mid-sized or small benchmarks, ViT achieves excellent results compared to state-of-the-art convolutional networks.",
    "text_summary": "Vision Transformer applies pure transformer to image patches, achieving strong classification results.",
    "image_summary": ["ViT patch embedding process", "ImageNet classification results"],
    "image_base_64": ["base64_vit_1", "base64_vit_2"],
    "evidence_level": ["strong", "strong"],
    "last_retrieved_at": null
}
