{
  "title": "Metformin-associated lactic acidosis: a case report",
  "year": "2021",
  "source_type": "journal article",
  "id": "case-003",
  "text_summary": "A single patient case of lactic acidosis during metformin therapy.",
  "text": "A 72-year-old man developed lactic acidosis after metformin dose escalation.",
  "image_summary": [],
  "image_base_64": [],
  "evidence_level": "case report",
  "last_retrieved_at": "2026-08-12"
}